{
  "$schema": "https://json-schema.org/draft/2020-12/schema",
  "$id": "https://theninthart.example/contracts/quadrant-slots-manifest.schema.json",
  "title": "Slots de imagem",
  "description": "Manifesto canônico de slots de imagem.",
  "type": "object",
  "required": [
    "schemaVersion",
    "manifestVersion",
    "locale",
    "generatedAt",
    "items"
  ],
  "properties": {
    "schemaVersion": {
      "const": "1.0.0"
    },
    "manifestVersion": {
      "type": "string"
    },
    "locale": {
      "const": "pt-BR"
    },
    "generatedAt": {
      "type": [
        "string",
        "null"
      ]
    },
    "items": {
      "type": "array",
      "minItems": 203,
      "maxItems": 203,
      "items": {
        "$ref": "quadrant-slot.schema.json"
      }
    }
  },
  "additionalProperties": false
}
