{
  "schemaVersion": "1.0.0",
  "manifestVersion": "1.0.0",
  "locale": "pt-BR",
  "generatedAt": null,
  "items": [
    {
      "id": "q01",
      "number": 1,
      "stableKey": "q01",
      "position": 1,
      "blockId": "assembly",
      "blockLabel": "Assembly",
      "fixedFunction": "Primeira batida da montagem. Pio recebe ou encaixa a primeira peça selecionada.",
      "narrativePurpose": "Primeira batida da montagem. Pio recebe ou encaixa a primeira peça selecionada.",
      "aspectClass": "narrow-vertical",
      "gridArea": "assembly-01",
      "continuityGroup": "machine-assembly",
      "narrativeWeight": 1.0,
      "previousQuadrant": null,
      "nextQuadrant": "q02",
      "gutterBefore": "g00",
      "gutterAfter": "g01",
      "affectedByControls": [
        "engrenagem-vegetal",
        "bobina-eletrica",
        "ampulheta-temporal",
        "tubo-vapor",
        "ima-pilao",
        "espiga-condutora",
        "cristal-memoria",
        "sensor-brasas",
        "prehistoria-terrestre",
        "prehistoria-aerea",
        "ancestral-indigena",
        "historico-mestico",
        "presente-expandido",
        "futuro-urbano",
        "futuro-distopico",
        "paradoxo-temporal",
        "mandioca",
        "milho",
        "tapioca",
        "bolo",
        "panela-barro",
        "forno-barro",
        "traco-indigena",
        "traco-afro-portugues",
        "humor",
        "assombro",
        "perigo",
        "melancolia",
        "vida",
        "morte",
        "imaginacao",
        "realidade"
      ],
      "affectedByWidgets": [
        "timeline",
        "public-kitchen",
        "machine-state",
        "dramatic-climate"
      ],
      "allowedVersionIds": [
        "v01",
        "v02",
        "v03",
        "v04",
        "v05",
        "v06",
        "v07"
      ],
      "imageRequired": true,
      "captionAllowed": true,
      "dialogueAllowed": true,
      "enabled": true,
      "metadata": {}
    },
    {
      "id": "q02",
      "number": 2,
      "stableKey": "q02",
      "position": 2,
      "blockId": "assembly",
      "blockLabel": "Assembly",
      "fixedFunction": "Segunda batida da montagem. Variação de pose, expressão e relação entre peças.",
      "narrativePurpose": "Segunda batida da montagem. Variação de pose, expressão e relação entre peças.",
      "aspectClass": "narrow-vertical",
      "gridArea": "assembly-02",
      "continuityGroup": "machine-assembly",
      "narrativeWeight": 1.0,
      "previousQuadrant": "q01",
      "nextQuadrant": "q03",
      "gutterBefore": "g01",
      "gutterAfter": "g02",
      "affectedByControls": [
        "engrenagem-vegetal",
        "bobina-eletrica",
        "ampulheta-temporal",
        "tubo-vapor",
        "ima-pilao",
        "espiga-condutora",
        "cristal-memoria",
        "sensor-brasas",
        "prehistoria-terrestre",
        "prehistoria-aerea",
        "ancestral-indigena",
        "historico-mestico",
        "presente-expandido",
        "futuro-urbano",
        "futuro-distopico",
        "paradoxo-temporal",
        "mandioca",
        "milho",
        "tapioca",
        "bolo",
        "panela-barro",
        "forno-barro",
        "traco-indigena",
        "traco-afro-portugues",
        "humor",
        "assombro",
        "perigo",
        "melancolia",
        "vida",
        "morte",
        "imaginacao",
        "realidade"
      ],
      "affectedByWidgets": [
        "timeline",
        "public-kitchen",
        "machine-state",
        "dramatic-climate"
      ],
      "allowedVersionIds": [
        "v01",
        "v02",
        "v03",
        "v04",
        "v05",
        "v06",
        "v07"
      ],
      "imageRequired": true,
      "captionAllowed": true,
      "dialogueAllowed": true,
      "enabled": true,
      "metadata": {}
    },
    {
      "id": "q03",
      "number": 3,
      "stableKey": "q03",
      "position": 3,
      "blockId": "assembly",
      "blockLabel": "Assembly",
      "fixedFunction": "Terceira batida. Surge uma pequena dificuldade técnica ainda controlável.",
      "narrativePurpose": "Terceira batida. Surge uma pequena dificuldade técnica ainda controlável.",
      "aspectClass": "narrow-vertical",
      "gridArea": "assembly-03",
      "continuityGroup": "machine-assembly",
      "narrativeWeight": 1.0,
      "previousQuadrant": "q02",
      "nextQuadrant": "q04",
      "gutterBefore": "g02",
      "gutterAfter": "g03",
      "affectedByControls": [
        "engrenagem-vegetal",
        "bobina-eletrica",
        "ampulheta-temporal",
        "tubo-vapor",
        "ima-pilao",
        "espiga-condutora",
        "cristal-memoria",
        "sensor-brasas",
        "prehistoria-terrestre",
        "prehistoria-aerea",
        "ancestral-indigena",
        "historico-mestico",
        "presente-expandido",
        "futuro-urbano",
        "futuro-distopico",
        "paradoxo-temporal",
        "mandioca",
        "milho",
        "tapioca",
        "bolo",
        "panela-barro",
        "forno-barro",
        "traco-indigena",
        "traco-afro-portugues",
        "humor",
        "assombro",
        "perigo",
        "melancolia",
        "vida",
        "morte",
        "imaginacao",
        "realidade"
      ],
      "affectedByWidgets": [
        "timeline",
        "public-kitchen",
        "machine-state",
        "dramatic-climate"
      ],
      "allowedVersionIds": [
        "v01",
        "v02",
        "v03",
        "v04",
        "v05",
        "v06",
        "v07"
      ],
      "imageRequired": true,
      "captionAllowed": true,
      "dialogueAllowed": true,
      "enabled": true,
      "metadata": {}
    },
    {
      "id": "q04",
      "number": 4,
      "stableKey": "q04",
      "position": 4,
      "blockId": "assembly",
      "blockLabel": "Assembly",
      "fixedFunction": "Quarta batida. A montagem recupera velocidade e confiança.",
      "narrativePurpose": "Quarta batida. A montagem recupera velocidade e confiança.",
      "aspectClass": "narrow-vertical",
      "gridArea": "assembly-04",
      "continuityGroup": "machine-assembly",
      "narrativeWeight": 1.0,
      "previousQuadrant": "q03",
      "nextQuadrant": "q05",
      "gutterBefore": "g03",
      "gutterAfter": "g04",
      "affectedByControls": [
        "engrenagem-vegetal",
        "bobina-eletrica",
        "ampulheta-temporal",
        "tubo-vapor",
        "ima-pilao",
        "espiga-condutora",
        "cristal-memoria",
        "sensor-brasas",
        "prehistoria-terrestre",
        "prehistoria-aerea",
        "ancestral-indigena",
        "historico-mestico",
        "presente-expandido",
        "futuro-urbano",
        "futuro-distopico",
        "paradoxo-temporal",
        "mandioca",
        "milho",
        "tapioca",
        "bolo",
        "panela-barro",
        "forno-barro",
        "traco-indigena",
        "traco-afro-portugues",
        "humor",
        "assombro",
        "perigo",
        "melancolia",
        "vida",
        "morte",
        "imaginacao",
        "realidade"
      ],
      "affectedByWidgets": [
        "timeline",
        "public-kitchen",
        "machine-state",
        "dramatic-climate"
      ],
      "allowedVersionIds": [
        "v01",
        "v02",
        "v03",
        "v04",
        "v05",
        "v06",
        "v07"
      ],
      "imageRequired": true,
      "captionAllowed": true,
      "dialogueAllowed": true,
      "enabled": true,
      "metadata": {}
    },
    {
      "id": "q05",
      "number": 5,
      "stableKey": "q05",
      "position": 5,
      "blockId": "assembly",
      "blockLabel": "Assembly",
      "fixedFunction": "Quinta batida. As peças começam a formar um sistema quase autônomo.",
      "narrativePurpose": "Quinta batida. As peças começam a formar um sistema quase autônomo.",
      "aspectClass": "narrow-vertical",
      "gridArea": "assembly-05",
      "continuityGroup": "machine-assembly",
      "narrativeWeight": 1.0,
      "previousQuadrant": "q04",
      "nextQuadrant": "q06",
      "gutterBefore": "g04",
      "gutterAfter": "g05",
      "affectedByControls": [
        "engrenagem-vegetal",
        "bobina-eletrica",
        "ampulheta-temporal",
        "tubo-vapor",
        "ima-pilao",
        "espiga-condutora",
        "cristal-memoria",
        "sensor-brasas",
        "prehistoria-terrestre",
        "prehistoria-aerea",
        "ancestral-indigena",
        "historico-mestico",
        "presente-expandido",
        "futuro-urbano",
        "futuro-distopico",
        "paradoxo-temporal",
        "mandioca",
        "milho",
        "tapioca",
        "bolo",
        "panela-barro",
        "forno-barro",
        "traco-indigena",
        "traco-afro-portugues",
        "humor",
        "assombro",
        "perigo",
        "melancolia",
        "vida",
        "morte",
        "imaginacao",
        "realidade"
      ],
      "affectedByWidgets": [
        "timeline",
        "public-kitchen",
        "machine-state",
        "dramatic-climate"
      ],
      "allowedVersionIds": [
        "v01",
        "v02",
        "v03",
        "v04",
        "v05",
        "v06",
        "v07"
      ],
      "imageRequired": true,
      "captionAllowed": true,
      "dialogueAllowed": true,
      "enabled": true,
      "metadata": {}
    },
    {
      "id": "q06",
      "number": 6,
      "stableKey": "q06",
      "position": 6,
      "blockId": "assembly",
      "blockLabel": "Assembly",
      "fixedFunction": "Sexta batida. Conclusão métrica da primeira sequência e preparação do título.",
      "narrativePurpose": "Sexta batida. Conclusão métrica da primeira sequência e preparação do título.",
      "aspectClass": "narrow-vertical",
      "gridArea": "assembly-06",
      "continuityGroup": "machine-assembly",
      "narrativeWeight": 1.0,
      "previousQuadrant": "q05",
      "nextQuadrant": "q07",
      "gutterBefore": "g05",
      "gutterAfter": "g06",